id,type,text,option,option,option,option,option,option,answers
1,select,Choose the correct spelling of the word.,priveleged,privileged,privilleged,privelleged,,,2
2,multiselect,Select all Russian emperors who ruled in the 18th century. (Split options with ";"),Catherine the First,Alexander the First,Anna Ioannovna,Peter the First,Elizabeth Petrovna,Alexander the Second,1;3;4;5
3,number,Write the year of the beginning of the Great Patriotic War.,,,,,,,1939
4,select,Choose the main nihilist of Russian literature.,Onegin,Bazarov,Chatsky,Chichikov,,,2
5,multiselect,Select all German car brands. (Split options with ";"),Audi,BMW,Renault,KIA,Opel,Daewoo,1;2;5
